<archivi_personali xmlns:xsi="http://www.w3.org/2001/XMLSchema-instance" xsi:noNamespaceSchemaLocation="archivioVolo.xsd">
    <archivio_personale>
        <nome>Marco</nome>
        <cognome>Rossi</cognome>
        <passaporto>123456789</passaporto>
        <prenotazioni>
            <prenotazione>
                <codice>P123</codice>
                <nome_compagnia>Ryanair</nome_compagnia>
                <tipo_volo>Andata-Ritorno</tipo_volo>
                <aeroporto_partenza>Bologna</aeroporto_partenza>
                <data_partenza>
                    <giorno>15</giorno>
                    <mese>8</mese>
                    <anno>2023</anno>
                </data_partenza>
                <ora_partenza>
                    <ora>10</ora>
                    <minuti>30</minuti>
                </ora_partenza>
                <aeroporto_arrivo>Ryanair</aeroporto_arrivo>
                <data_arrivo>
                    <giorno>16</giorno>
                    <mese>8</mese>
                    <anno>2023</anno>
                </data_arrivo>
                <ora_arrivo>
                    <ora>14</ora>
                    <minuti>45</minuti>
                </ora_arrivo>
            </prenotazione>
            <prenotazione>
                <codice>P124</codice>
                <nome_compagnia>Ryanair</nome_compagnia>
                <tipo_volo>Solo-Andata</tipo_volo>
                <aeroporto_partenza>Aeroporto C</aeroporto_partenza>
                <data_partenza>
                    <giorno>20</giorno>
                    <mese>8</mese>
                    <anno>2023</anno>
                </data_partenza>
                <ora_partenza>
                    <ora>15</ora>
                    <minuti>45</minuti>
                </ora_partenza>
                <aeroporto_arrivo>Bologna</aeroporto_arrivo>
                <data_arrivo>
                    <giorno>20</giorno>
                    <mese>5</mese>
                    <anno>2023</anno>
                </data_arrivo>
                <ora_arrivo>
                    <ora>18</ora>
                    <minuti>30</minuti>
                </ora_arrivo>
            </prenotazione>
        </prenotazioni>
    </archivio_personale>
    <archivio_personale>
        <nome>Giovanna</nome>
        <cognome>Bianchi</cognome>
        <passaporto>987654321</passaporto>
        <prenotazioni>
            <prenotazione>
                <codice>P125</codice>
                <nome_compagnia>Ryanair</nome_compagnia>
                <tipo_volo>Andata-Ritorno</tipo_volo>
                <aeroporto_partenza>Bologna</aeroporto_partenza>
                <data_partenza>
                    <giorno>22</giorno>
                    <mese>8</mese>
                    <anno>2023</anno>
                </data_partenza>
                <ora_partenza>
                    <ora>12</ora>
                    <minuti>0</minuti>
                </ora_partenza>
                <aeroporto_arrivo>ciao</aeroporto_arrivo>
                <data_arrivo>
                    <giorno>23</giorno>
                    <mese>9</mese>
                    <anno>2023</anno>
                </data_arrivo>
                <ora_arrivo>
                    <ora>16</ora>
                    <minuti>30</minuti>
                </ora_arrivo>
            </prenotazione>
            <prenotazione>
                <codice>P126</codice>
                <nome_compagnia>Airline D</nome_compagnia>
                <tipo_volo>Solo-Andata</tipo_volo>
                <aeroporto_partenza>Aeroporto G</aeroporto_partenza>
                <data_partenza>
                    <giorno>25</giorno>
                    <mese>8</mese>
                    <anno>2023</anno>
                </data_partenza>
                <ora_partenza>
                    <ora>9</ora>
                    <minuti>15</minuti>
                </ora_partenza>
                <aeroporto_arrivo>Aeroporto H</aeroporto_arrivo>
                <data_arrivo>
                    <giorno>25</giorno>
                    <mese>8</mese>
                    <anno>2023</anno>
                </data_arrivo>
                <ora_arrivo>
                    <ora>11</ora>
                    <minuti>30</minuti>
                </ora_arrivo>
            </prenotazione>
        </prenotazioni>
    </archivio_personale>
</archivi_personali>
